{
  "$schema": "https://cdn.jsdelivr.net/gh/clshortfuse/renodx/renodx-metadata-schema.json",
  "id": "alicemadnessreturns",
  "title": "Alice: Madness Returns",
  "maintainers": [
    "Steve161803"
  ],
  "status": "stable",
  "urls": [
    {
      "url": "https://www.nexusmods.com/alicemadnessreturns/mods/67",
      "kind": "nexus_mods"
    }
  ],
  "deploy": {
    "steam_appid": 19680,
    "architecture": [
      "x86"
    ]
  }
}
