{
  "$schema": "https://cdn.jsdelivr.net/gh/clshortfuse/renodx/renodx-metadata-schema.json",
  "id": "metaphorrefantazio",
  "title": "Metaphor: ReFantazio",
  "maintainers": [
    "Ritsu"
  ],
  "status": "stable",
  "urls": [
    {
      "url": "https://www.nexusmods.com/metaphorrefantazio/mods/50",
      "kind": "nexus_mods"
    }
  ],
  "deploy": {
    "steam_appid": 2679460
  }
}
