{
  "$schema": "https://cdn.jsdelivr.net/gh/clshortfuse/renodx/renodx-metadata-schema.json",
  "id": "darksouls",
  "title": "Dark Souls: Remastered",
  "maintainers": [
    "Musa"
  ],
  "status": "stable",
  "urls": [
    {
      "url": "https://www.nexusmods.com/darksoulsremastered/mods/822",
      "kind": "nexus_mods"
    }
  ],
  "deploy": {
    "steam_appid": 570940
  }
}
