{
  "$schema": "https://cdn.jsdelivr.net/gh/clshortfuse/renodx/renodx-metadata-schema.json",
  "id": "thesurge",
  "title": "The Surge",
  "maintainers": [
    "Voosh"
  ],
  "status": "stable",
  "urls": [
    {
      "url": "https://www.nexusmods.com/thesurge/mods/4/",
      "kind": "nexus_mods"
    }
  ],
  "deploy": {
    "steam_appid": 378540
  }
}
