{
  "$schema": "https://cdn.jsdelivr.net/gh/clshortfuse/renodx/renodx-metadata-schema.json",
  "id": "cronosthenewdawn",
  "title": "Cronos: The New Dawn",
  "maintainers": ["Ersh"],
  "compatibility": "working",
  "urls": [{"kind": "nexus", "url": "https://www.nexusmods.com/cronosthenewdawn/mods/13"}],
  "deploy": {
    "steam_appid": 2101960
  }
}
