{
  "$schema": "https://cdn.jsdelivr.net/gh/clshortfuse/renodx/renodx-metadata-schema.json",
  "id": "outerworlds2",
  "title": "The Outer Worlds 2",
  "maintainers": ["Ritsu"],
  "compatibility": "working",
  "urls": [{"kind": "nexus", "url": "https://www.nexusmods.com/theouterworlds2/mods/77"}],
  "deploy": {
    "steam_appid": 1449110
  }
}
