{
  "$schema": "https://cdn.jsdelivr.net/gh/clshortfuse/renodx/renodx-metadata-schema.json",
  "id": "talesofgracesf",
  "title": "Tales of Graces f Remastered",
  "maintainers": [
    "Ritsu"
  ],
  "status": "stable",
  "urls": [
    {
      "url": "https://www.nexusmods.com/talesofgracesfremastered/mods/6/",
      "kind": "nexus_mods"
    }
  ],
  "deploy": {
    "steam_appid": 2530980
  }
}
