{
  "$schema": "https://cdn.jsdelivr.net/gh/clshortfuse/renodx/renodx-metadata-schema.json",
  "id": "hollowknight-silksong",
  "title": "Hollow Knight: Silksong",
  "maintainers": [
    "ShortFuse"
  ],
  "status": "stable",
  "summary": "Adds HDR support, reduced banding, adds tone mapper, and film grain.",
  "tags": [
    "graphics",
    "hdr",
    "tone-mapping",
    "film-grain",
    "quality-of-life"
  ],
  "notes": [
    "Disable exclusive fullscreen"
  ],
  "header": "https://shared.fastly.steamstatic.com/store_item_assets/steam/apps/1030300/header.jpg",
  "deploy": {
    "game_exe": "Hollow Knight Silksong.exe",
    "nexus_mods_game_id": 8136,
    "steam_appid": 1030300
  }
}
