{
  "$schema": "https://cdn.jsdelivr.net/gh/clshortfuse/renodx/renodx-metadata-schema.json",
  "id": "tekken8",
  "title": "Tekken 8",
  "maintainers": [
    "Ritsu"
  ],
  "status": "stable",
  "urls": [
    {
      "url": "https://www.nexusmods.com/tekken8/mods/513",
      "kind": "nexus_mods"
    }
  ],
  "deploy": {
    "steam_appid": 1778820
  }
}
