{
  "$schema": "https://cdn.jsdelivr.net/gh/clshortfuse/renodx/renodx-metadata-schema.json",
  "id": "koarr",
  "title": "Kingdoms of Amalur: Re-Reckoning",
  "maintainers": [
    "Voosh"
  ],
  "status": "stable",
  "urls": [
    {
      "url": "https://www.nexusmods.com/kingdomsofamalurrereckoning/mods/54/",
      "kind": "nexus_mods"
    }
  ],
  "deploy": {
    "steam_appid": 1041720,
    "architecture": [
      "x86"
    ]
  }
}
