{
  "$schema": "https://cdn.jsdelivr.net/gh/clshortfuse/renodx/renodx-metadata-schema.json",
  "id": "deathstrandingdc",
  "title": "Death Stranding Director's Cut",
  "maintainers": [
    "Musa"
  ],
  "status": "beta",
  "urls": [
    {
      "url": "https://www.nexusmods.com/deathstranding/mods/95",
      "kind": "nexus_mods"
    }
  ],
  "deploy": {
    "steam_appid": 1850570
  }
}
