{
  "$schema": "https://cdn.jsdelivr.net/gh/clshortfuse/renodx/renodx-metadata-schema.json",
  "id": "robocop",
  "title": "RoboCop: Rogue City",
  "maintainers": [
    "Musa"
  ],
  "status": "stable",
  "urls": [
    {
      "url": "https://github.com/clshortfuse/renodx/discussions/496",
      "kind": "discussion"
    }
  ],
  "deploy": {
    "steam_appid": 1681430
  }
}
