{
  "$schema": "https://cdn.jsdelivr.net/gh/clshortfuse/renodx/renodx-metadata-schema.json",
  "id": "infinity-nikki",
  "title": "Infinity Nikki",
  "maintainers": [
    "Maple"
  ],
  "status": "stable",
  "notes": [
    "Injecting ReShade into the game is left as an exercise for the reader, no help will be given with bypassing ACE."
  ],
  "deploy": {
    "steam_appid": 3164330
  }
}