{
  "$schema": "https://cdn.jsdelivr.net/gh/clshortfuse/renodx/renodx-metadata-schema.json",
  "id": "madmax",
  "title": "Mad Max",
  "maintainers": [
    "Steve161803"
  ],
  "status": "stable",
  "urls": [
    {
      "url": "https://www.nexusmods.com/madmax/mods/139",
      "kind": "nexus_mods"
    }
  ],
  "deploy": {
    "steam_appid": 234140
  }
}
